{
  "$schema": "https://json-schema.org/draft/2020-12/schema",
  "$id": "https://fillink.invalid/schemas/submission-0.1.0.schema.json",
  "title": "Fillink submission",
  "description": "Draft envelope for structured form data linked to a versioned template.",
  "type": "object",
  "additionalProperties": false,
  "required": ["formatVersion", "id", "template", "locked", "data"],
  "properties": {
    "$schema": {
      "type": "string",
      "format": "uri-reference"
    },
    "formatVersion": {
      "const": "0.1.0",
      "description": "Version of the Fillink submission envelope format."
    },
    "id": {
      "type": "string",
      "format": "uuid"
    },
    "createdAt": {
      "type": "string",
      "format": "date-time"
    },
    "template": {
      "type": "object",
      "additionalProperties": false,
      "required": ["uri", "version"],
      "properties": {
        "uri": {
          "type": "string",
          "format": "uri",
          "description": "Stable identifier for the template, not necessarily a directly fetchable URL."
        },
        "version": {
          "type": "string",
          "minLength": 1,
          "description": "Immutable template release/version identifier."
        },
        "sha256": {
          "type": "string",
          "pattern": "^[a-f0-9]{64}$",
          "description": "Optional lowercase SHA-256 hex digest of the exact template artifact bytes."
        }
      }
    },
    "data": {
      "type": "object",
      "description": "The form answers. Validate against the data schema published by the referenced template."
    },
    "locked": {
      "type": "boolean",
      "description": "Whether the viewer should make the submission read-only. This is an application state flag, not tamper protection or proof of signing."
    }
  }
}
